name,cefr,textdix-pour-cent-la-bonne-recette-suite,B1," ""Dix pour Cent"" : la bonne recette (suite)  Donc la saison 2, même au tout début j'avais des paniques [au] bord de l'hystérie,  je demandais au réalisateur : ""Mais est-ce que Hervé est là ? Il est bien là ?"" Comme si... (rires) Et il disait : ""Tu te calmes."" ""Oui, non non, mais j'ai grossi, euh, Hervé normalement, il est comme ci, il est comme ça !"" Il fait : ""On se calme. Hervé, c'est toi.""  L'autre force de la série, c'est le scénario. À l'instar des séries américaines références comme ""À la Maison Blanche"", l'écriture y est collective.  On part d'un constat qui est tout simple, c'est qu'on est meilleur avec six cerveaux qu'avec un seul. Et donc on travaille avec certains d'entre eux sur l'élaboration de ce qu'on appelle les arches de la série, donc pendant deux ou trois mois on réfléchit à  tout ce qui va arriver  à nos personnages récurrents dans la série. Une fois que ce travail-là est fait, après moi je découpe chaque épisode et je le confie à un auteur ou deux auteurs plus particulièrement, qui vont être en charge de leur épisode, et puis après moi je repasse beaucoup sur les dialogues à la fin.  Moi je [ne] peux pas dormir chez mes parents ! Ça me déprime-angoisse ! Au bout de deux heures dans cette baraque, j'ai envie de me foutre la tête dans le micro-ondes ! Merci. Tu changes.  Cet effort qu'on a fait d'avoir décortiqué les séries américaines - de toutes nos forces en fait ! - pour vraiment essayer de comprendre comment ils font, comment ils réussissent à associer la tension, l'empathie, pour que les gens aient envie de revenir, quoi !  Et pour les paillettes, il faut se tourner vers le plus célèbre ancien agent de stars, Monsieur Dominique Besnehard,  qui fournit moults [sic: moult] anecdotes et chouchoute les invités.  Les ""guests"", ce [ne] sont quand même que des histoires qui ont existé, auxquelles j'ai participé,  ou [que] j'ai vécues. Les couples d'acteurs [surpris] par les paparazzi, je ne dirai pas lesquels, ça c'est [sic: ce sont] des situations que j'ai connues. Cannes ! Vous pouvez repenser peut-être à Sophie Marceau... C'est pour ça que ça fonctionne cette série, parce que tout est vrai. Et que même s'il y a une dramatisation, au départ, [il] y a des [sic: de] vrais sentiments, [il] y a une sincérité dans les rapports, dans les caractères des gens... Et je pense que c'est ça, la valeur de la série.  Et enfin, cerise sur le gâteau, c'est la présence de stars qui se prêtent au jeu en ayant plaisir à manier la dérision.  J[e n]'ai pas envie de faire des blagues, j[e n]'ai pas envie qu'on m'aime bien, j[e n]'ai pas envie que Drucker m'aime, j[e n]'ai pas envie de caresser son chien !  On sait bien rire des autres, mais pas forcément bien de nous-mêmes. Les Américains l'ont beaucoup plus que nous [cette capacité], et encore plus à Hollywood qui est un tel système, un tel business, que les gens ont appris à rigoler avec leur propre business. Nous en France, est-ce que le cinéma, c'est vraiment un business comme l'est Hollywood ? Non, nous, c'est plus artisanal,  c'est plus opaque, plus discret, plus auteur aussi... Donc on a moins, je pense,  ce côté ""on regarde une industrie"".  Vous [ne] voulez pas venir au théâtre ? Et on dînerait après ? Mais comme ça, gratuitement, sans projet, rien,  qu'on puisse faire une fois de temps en temps quelque chose de gratuit.  ""Dix pour Cent"" c'est ça aussi, c'est un regard sur le cinéma, la culture, sur ces acteurs qui nous font rêver, qui nous habitent, qui nous accompagnent depuis longtemps dans nos vies, en fait. C'est aussi un témoignage d'amour pour le cinéma, cette série.  Ça me va. "
et-tout-le-monde-s-en-fout-l-eau,B1," Et tout le monde s'en fout # 4 - L'eau  Je voudrais juste aborder une broutille : l'eau.  Si on arrêtait de s'en foutre ?  Parce que [il n']y a que 3% de l'eau  qu[i] est potable sur Terre. Pour que tu comprennes :  si on prenait toute l'eau de la Terre et qu'on la mettait dans une baignoire, l'eau potable correspondrait au volume de ça !   C'est pour ça qu'en toute cohérence, on a décidé de tout faire avec, sauf d'en boire.  ""Moi de l'eau, j'en bois tout le temps. Tu dis n'importe quoi avec ta coupe d'ananas.""  Bon, lis sur mes lèvres.  Ça, c'est toi, et ça, c'est toute l'eau potable que tu consommes. 39% de toute l'eau que tu consommes, elle finit dans ta douche. 34% dans ton évier, 20% dans tes chiottes, 6%, on [ne] sait pas trop, et ça là, ce qui reste, c'est ce que tu bois. Tu le vois ? Tu [ne] le vois pas ? C'est normal, c'est 1% !  Et pendant ce temps-là, dans des endroits où t[u n]'as pas envie d'être, [il] y a un humain sur sept qui [n']a pas d'eau potable. T[u] es toujours là ?  Au passage, selon le CNRS [Centre National de la Recherche Scientifique],  un Malgache consomme 10 litres d'eau par jour alors qu'un Français a besoin de 137 litres d'eau par jour pour son usage personnel. Et pour le reste de la cuillère d'eau potable, [il] y en a 20% pour l'industrie, et 70 pour l'agriculture.  Pourtant en France, [il] y a un agriculteur autodidacte, Pascal Poot, qui fait pousser ses légumes sans une goutte d'eau. Juste en plantant les bonnes graines. Depuis trente ans. Sa technique est subtile :  ""Je fais exprès de [ne] rien faire du tout. Je les plante  et après je reviens ramasser les tomates, trois mois après.""  C'est un peu compliqué, mais on peut y arriver. Bon, ok, ça produit deux fois moins que des graines transgéniques. Ben ça tombe bien, vu qu'on consomme deux fois trop.  ""Oui, mais c'est bon, l'eau [il] y en a plein partout sur la planète, et dans mon robinet. Arrête de me saoûler !""  C'est ton argument ? Non c'est mignon, c'est mignon... L'eau qu'on consomme, elle vient des glaciers, des nappes phréatiques, et des neiges éternelles. Mais quand un climat se réchauffe, parce qu'on s'en fout, ben forcément, ça fait fondre les glaciers, ça pollue les nappes phréatiques, et ça tue les neiges éternelles. Et ça, c'est balèze !  Et nous, pendant ce temps-là, parce qu'on s'en fout, on balance en masse du mercure dans les nappes phréatiques en Guyane pour faire remonter des paillettes d'or à la surface. Non, mais c'est vrai que c'est joli, les paillettes ! Ah sinon, [il] y a l'Espagne qui achète de l'eau à la France - alors qu'elle manque d'eau - et qui fait pousser des fraises toute l'année !  Ou alors on fabrique des bouteilles d'eau, en plastique. Et fabriquer une bouteille d'un litre d'eau, ça consomme trois litres d'eau. On fait N'IMPORTE QUOI ! Alors bientôt, avec toutes nos bonnes idées,  en 2030, [il] y aura un quart d'eau potable en moins sur la planète. Attends, un quart de la cuillère en moins, ça fait... Merde ! Tu vois ce que tu me fais faire ! Et vu la démographie, on prévoit que [il] y aura trois humains sur sept  qui n'y auront pas accès.  Alors sachant qu'il te faut six litres d'eau en trois jours - sinon tu meurs - et sachant que tes chiottes contiennent à peu près neuf litres d'eau, on pourrait imaginer qu'à chaque fois que tu tires la chasse d'eau, tu tues 5,2 personnes ! C'est cool ou pas ?  Oui bonsoir, est-ce qu'on [ne] pourrait pas trouver un système pour que l'eau potable [n']aille pas dans mes toilettes, s'il vous plaît ?  [vous êtes] bien aimables Parce que l'eau potable, c'est gentil, c'est précieux, c'est ton amie. Et nous, on chie dedans. Tous les jours.  Et tout le monde s'en fout ! "
euro-2016,B1," Championnat d'Europe de football 2016 La quinzième édition du Championnat d'Europe de football, dit « Euro 2016 », se tient en France du 10 juin au 10 juillet.  Cette année, le nombre d'équipes passe de 16 à 24. Les nouvelles venues incluent l'Irlande du Nord, le pays de Galles et la Slovaquie qui y participeront pour la première fois, et l'Albanie et l'Islande qui feront leur entrée sur la scène internationale.  En revanche, trois anciens champions d'Europe - le Danemark, la Grèce et les Pays-Bas - ne se sont pas qualifiés cette année.  Cette compétition a lieu tous les quatre ans, et chaque édition jouit d'une campagne de marketing unique. Cette année comprend le logo ci-dessus ; une mascotte, Super Victor ; un ballon nommé « Beau Jeu »  ainsi qu'"
festival-de-cannes,B1," Festival de Cannes, au-delà des marches Le Festival de Cannes est né le 20 septembre 1946, dans le premier Palais des Festivals,  spécialement construit pour l'occasion. Événement annuel international depuis lors - sauf en 1948 et 1950 -  il a été créé pour concurrencer la Mostra de Venise. Cannes est devenu très rapidement un festival prestigieux, grâce à la venue du monde entier de stars du grand écran et de la presse de plus en plus nombreuses.  Un nouveau palais a été construit en 1979, pour accueillir un festival au succès croissant. Situé sur le Boulevard de la Croisette, le bâtiment de style moderniste de six étages a ouvert en 1982, puis s'est agrandi en 1999. On le surnomme le ""bunker"". Le Palais est le cœur du festival qui dure 12 jours.  Les vedettes montent les fameuses 24 marches, appelées les ""Marches de la Gloire"", s'arrêtent sur le tapis rouge pour prendre la pose devant des centaines de photographes et télévisions. Puis les stars se dirigent vers le Grand Auditorium Louis Lumière et ses 2.300 fauteuils.  C'est là que se déroulent les cérémonies d'ouverture et de fermeture du Festival. Les projections officielles ont lieu deux fois par soirée, auxquelles assistent des invités qui observent, tout comme les journalistes présents sur le tapis rouge, un code vestimentaire strict. C'est aussi ici que la prestigieuse Palme d'Or est décernée au réalisateur du meilleur film en compétition.  Au sous-sol se tient le Marché du Film, l'occasion pour les professionnels du cinéma de découvrir, acheter et vendre  des milliers de nouveaux films ou projets.  Et pour ceux qui ne peuvent pas accéder au ""bunker"", des projections de films ont lieu en plein air sur les plages le long de la Croisette. "
festival-des-cerfs-volants,B1," A Berck, les cerfs-volants sont dans le vent Caroline, qui est notre sourire d'Arras hein, puisque c'est notre consœur de France 3 Nord-Pas-de-Calais, bureau d'Arras. Et bien, on va prendre de la hauteur, mais pour une fois, pas avec un drone, parce que c'est vrai qu'on est champions du drone, mais là, tu as trouvé autre chose.  Non, non, je vous emmène sur la côte. Imaginez un ciel qui se pare de couleurs, envahi par des pieuvres géantes, des crocodiles, des dragons ... un spectacle somptueux. C'est tous les ans à la... sur la plage de Berck-sur-Mer : le festival international du cerf-volant. Ça fait 30 ans que ça dure, et tous les ans, vous allez le voir, c'est l'occasion pour les cerf-volistes venus du monde entier de se mesurer dans des chorégraphies de haut vol.  187, merci.  C'est une bande de flics qui se retrouvent chaque année sur la plage de Berck. FLIC, comme Fédération Libertine et Indépendante de Cerf-volant. Ils sont adeptes du quatre lignes, comme le nombre de fils qui les relient à leur engin volant.  ... sur 7, 360.  Quand je dis « bas », tout le monde sait qu'il doit faire un demi-tour vers le bas, du coup ça permet d'avoir des ordres extrêmement courts, extrêmement simples, et vu qu'on se connaît depuis plus de 20 ans pour certains, ben, on percute de suite dessus donc on arrive à bien, vraiment bien s'amuser, sans avoir forcément la rigueur d'un compétiteur qui prépare et répète une routine pendant tout l'hiver ... c'est trop fort pour nous, ça.  Ils ne sont pas là pour la compétition, mais leur art est œuvre de haute précision. Un peu plus loin sur la plage, les pionniers du cerf-volant quatre lignes. The Decorators sont présents sur la plage de Berck depuis 22 ans.  Vous pouvez voler dans presque n'importe quelles conditions de vent. Vous contrôlez la vitesse,  c'est fou la qualité esthétique que vous pouvez obtenir avec ces cerfs-volants, vous pouvez l'arrêter dans le ciel, tourner. Pour nous, c'est comme de la sculpture ou de la peinture, c'est très esthétique.  Et plus ils sont nombreux, plus ils s'amusent. Les adeptes du Révolution, l'autre nom du cerf-volant quatre lignes, ne sont jamais plus heureux que lorsqu'ils se retrouvent en mégateam. Vingt pilotes, cela fait 80 fils qui se mêlent.  C'est pas plus complexe, c'est juste le plaisir est multiplié d'autant.  On retrouve des copains du monde entier qu'on voit pas forcément que à [should be ""qu'à""] Berck mais on arrive à les voir tous en même temps ici, ou presque. Et puis le vent est génial, la plage est super grande.  Bref, ces pilotes-là sont des peintres sur ciel qui cultivent le partage de leur art avec humour et poésie. "
france-gall-la-groupie-du-pianiste,B1," France Gall, la groupie du pianiste Le dimanche 7 janvier 2018,  la France a perdu l'une de ses interprètes les plus populaires. France Gall s'est éteinte des suites d'un cancer du sein à l'âge de 70 ans. La carrière de cette artiste au charme mutin et à la voix unique a réussi la prouesse de traverser les décennies. À la fois idole des années 60, 70 et 80, France Gall a connu des hauts et des bas professionnels comme personnels, mais en est toujours sortie plus forte.   Alors qu'elle est encore mineure, son père Robert Gall, compositeur, signe pour elle un contrat chez la maison de disques Philips. Le jour de ses 16 ans sort son premier disque, qui connaît un succès immédiat. Son producteur a alors l'idée de la faire collaborer avec un autre de ses poulains, le jeune Serge Gainsbourg, qui lui écrit de nombreux morceaux qui se placent à la tête des hit-parades.  En mars 1965, France Gall est choisie pour représenter le Luxembourg au concours de l'Eurovision. Avec sa chanson Poupée de cire, poupée de son, elle remporte à 19 ans la fameuse compétition, et rien ne semble pouvoir l'arrêter. En 1966, elle chante Les Sucettes écrite par Gainsbourg,  dont les sous-entendus n'échappent qu'à sa naïve interprète. Ses fans habituels la boudent, et lorsque France réalise le sens caché de la chanson, elle se sent humiliée  au point de se retirer quelque temps de la vie publique.  Alors qu'elle cherche encore son propre style, elle entend un jour à la radio un jeune chanteur, Michel Berger, dont la musique la séduit immédiatement. Elle va à sa rencontre  et lui demande même des conseils sur ses propres chansons. Une relation professionnelle commence, qui se transforme au fil des mois en une belle histoire d'amour. Leur collaboration est à l'origine des plus grands tubes de France Gall : La déclaration, qu'il écrit en pensant à elle, la comédie musicale Starmania, Il jouait du piano debout, Évidemment, etc Tout semble leur sourire.  Mais alors qu'ils viennent d'enregistrer un album à deux voix, Michel Berger est victime d'une crise cardiaque, et décède le 2 août 1992, à l'âge de 44 ans. France Gall se retire alors temporairement de la vie publique, et quand cinq ans plus tard, en 1997, elle perd sa fille Pauline, 19 ans, atteinte de mucoviscidose, elle met définitivement fin à sa carrière.  Elle ne reviendra désormais sur le devant de la scène que pour rendre hommage à la musique de Michel Berger, comme en 2015 où elle crée la comédie musicale Résiste, qu'elle met en scène avec son nouveau compagnon Bruck Dawit.  Voici une sélection des tubes de France Gall, qui vont de son succès de l'Eurovision 1965 aux années ""Berger"". "
french-elections,B1," Les élections présidentielles En France, il y a six types d'élections : 1. Les élections présidentielles pour choisir un président tous les cinq ans 2. Les élections législatives pour élire les députés de l'Assemblée Nationale tous les cinq ans 3. Les élections sénatoriales pour remplir le Sénat tous les trois ans 4. Les élections régionales pour choisir les membres des conseils régionaux tous les six ans 5. Les élections départementales pour sélectionner les membres des conseils départementaux tous les trois ans 6. Les élections municipales pour désigner les conseillers municipaux tous les six ans  Comme toutes les élections françaises, les présidentielles se passent en deux tours. Lors du premier tour, des candidats de tous les partis peuvent se présenter. Si aucun ne reçoit une majorité (ce qui est toujours le cas), un deuxième tour aura lieu deux semaines après pour que les deux candidats en tête puissent s'affronter.  Le gagnant ou la gagnante deviendra le prochain président ou la prochaine présidente de la République et son quinquennat démarrera le lendemain. "
game-of-thrones-no-spoilers,B1," ""Game of Thrones"", la série de tous les records  Un succès ... dévastateur. ""Game of Thrones"", la série de tous les records. Record d'audience d'abord : de 9 millions de téléspectateurs en moyenne pour la saison 1, rien qu'aux États-Unis, le chiffre passe à plus de 30 millions pour la saison 7. En quelques années, ""Game of Thrones"" est devenu un phénomène de société, à tel point que la série a été téléchargée illégalement plus d'1 milliard de fois, et que l'une des héroïnes, Daenerys, a donné son prénom à 45 petites filles en France.  Pour cette spécialiste américaine des médias, c'est parce que la série est exceptionnelle. ""Game of Thrones"" est une formidable histoire. Il y a du sexe, de la violence, de l'argent, et quantité de beaux acteurs. Comment pourrait-elle ne pas plaire ? Il y a beaucoup de bonnes séries télévisées, mais celle-ci est hors-du-commun.  Hors-du-commun également, le budget de la série. À l'origine, il était de 5 millions de dollars par épisode. Pour cette huitième saison, il a atteint les 15 millions de dollars, toujours par épisode, dont cinq millions et demi de dollars  rien qu'en cachets pour les 5 acteurs principaux. Pourtant, pour la chaîne payante HBO,  c'est un bon calcul : ""Game of Thrones"" lui rapporte 1 milliard de dollars de profit par an. HBO a d'ailleurs prévu une suite, ou plutôt une genèse à la saga. L'épisode-test d'une série qui se passe mille ans avant les évènements de ""Game of Thrones"", doit être tourné cet été. "
haiti-s-story-of-independence,B1," Histoire de l'indépendance d'Haïti Alors, si je vous dis « révolution haïtienne », vous pensez à ... ?  Toussaint Louverture, entre autres.  Évidemment, parce que c'est le plus connu, mais il n'est pas le seul, et justement ce soir, je vous présente le premier Noir qui a mené une révolte à Haïti. Il s'agit de Houngan Dutty Boukman Zumba qui était un esclave africain et qui a rassemblé 200 compagnons pour mener une révolte :  la première révolte de grande ampleur sur l'île d'Haïti.  Alors, cette réunion était extraordinaire pour l'époque puisque, rappelons-nous, il n'y avait pas les moyens de communication longue portée et instantanés  que nous connaissons aujourd'hui.   Pas de téléphone, quoi.  Donc, rassembler des centaines d'esclaves  qui viennent de plantations très éloignées, c'était un énorme défi. Il l'a relevé, Dutty Boukman,  il a réussi à rassembler donc des centaines d'esclaves  qui ont répondu à son appel parce qu'ils étaient complètement opprimés et poussés à bout par la cruauté de leur traitement. Du coup, au cours de cette réunion,  Dutty Boukman a prononcé un discours qui les a complètement galvanisés, qui leur a tous donné le courage de se révolter contre la domination coloniale. Alors, comment ça s'est passé ?  Comment ça s'est passé ?  Eh bien, des esclaves de toute l'île se sont insurgés en même temps, ils se sont donné le mot, et du coup ils ont incendié plusieurs plantations, ils ont tué des esclavagistes,  et cette révolte a duré 10 jours, au cours desquels les esclaves ont goûté à la liberté : ça veut dire, plus de travail forcé, plus de coups de fouet, plus de torture, des familles séparées qui se retrouvent, et surtout surtout  ils mangent tous à leur faim.  Alors, malheureusement au bout de ces 10 jours,  l'armée française était mieux organisée, mieux équipée, donc finalement elle a pris le dessus. Elle a réussi à capturer Dutty Boukman et elle l'a tué.  Et en plus elle a poussé la revanche [jusqu']à décapiter Dutty Boukman et a montré sa tête,  pendant plusieurs jours ils l'ont exposée pour pouvoir déstabiliser le reste des révoltés,  et ça a réussi, ça a semé la panique,  et ils ont finalement été vaincus.  Mais même si cette révolte a fini par un échec,  elle aura eu le mérite d'inciter des meneurs par la suite à continuer cet élan de révolte, comme c'est le cas de Jean-François [Papillon], de [Georges] Biassou ou encore de Toussaint Louverture le fameux, et de Jean-Jacques Dessalines.  Alors, je n'ai pas simplement pris Dutty Boukman juste pour son courage extraordinaire, mais également parce que nous sommes au mois de janvier. Le 1er janvier 2017, Haïti a célébré sa 213e année d'indépendance, et cette indépendance finalement, c'est Boukman Dutty  qui a mené, qui a ouvert la voie à cette indépendance. C'est également grâce à Haïti que beaucoup de pays d'Afrique et de la Caraïbe ont obtenu leur émancipation à leur tour.  Haïti est la première, toute première nation noire à avoir obtenu son indépendance.  Donc j'ai un message pour la communauté haïtienne de Guyane qui nous regarde :  vous avez une histoire grandiose. S'il vous plaît, soyez-en fiers  et surtout, montrez-en-vous dignes ! [sic: montrez-vous-en dignes] "
il-est-ne-le-divin-enfant,B1," Il est né, le divin Enfant - paroles Refrain :  Il est né, le divin Enfant  Jouez hautbois ! Résonnez musettes !  Il est né, le divin Enfant  Chantons tous son avènement !  Depuis plus de quatre mille ans,  Nous le promettaient les Prophètes  Depuis plus de quatre mille ans,  Nous attendions cet heureux temps.  Refrain  Ah ! Qu'il est beau !  Qu'il est charmant !  Ah ! Que ses grâces sont parfaites !  Ah ! Qu'il est beau ! Qu'il est charmant !  Qu'il est doux ce divin Enfant !  Refrain  Une étable est son logement,  Un peu de paille est sa couchette,  Une étable est son logement,  Pour un Dieu, quel abaissement !  Refrain  Partez, grands Rois de l'Orient !  Venez vous unir à nos fêtes !  Partez, grands Rois de l'Orient !  Venez adorer cet Enfant !  Refrain  "
