name,cefr,textle-ski-tetes-a-claques,B2," Le ski - Têtes à Claques  - 9-1-1 ?   - Bonjour, j'appelle  pour que envoyiez tout de suite une ambulance au Mont Tremblant.  - [Il] y a eu un accident ?  - Pas encore, mais dans deux minutes ça va être l'hécatombe, là ! Faites que... Prenez de l'avance, je pense que ça [ne] prend pas de temps.   - Mais de quoi vous parlez, Monsieur ?  - Hé, vous savez ça ressemble à quoi un missile cruise avec une tuque ?  - Non.  - Ben moi oui. T[u n]'as qu'à envoyer l'ambulance tout de suite !  - Monsieur, calmez-vous, là, puis dites-moi ce qui se passe.  - [Il] y a un gars là qui descend à 200km/h sur ses skis là, puis qui [ne] sait pas pantoute [FR: pas du tout] comment [s']arrêter là. Hé ! En avant ! Tassez-vous ! Tassez-vous ! [FR: Poussez-vous !]  - C'est vous, le gars hein ?  - Ouais, c'est moi.  - Monsieur, là, essayez de vous arrêter en visant un petit sapin, je [ne] sais pas...  - Ah j'ai déjà essayé, ça [n']a pas marché  puis j'ai des cocottes plein les shorts là. [FR: j'ai les chocottes !]  - Il vous reste combien de temps avant d'arriver en bas, là ?  - Ben j'arrive là,  je vois le monde en bas, puis c'est plein de monde là ! Tassez-vous en avant ! [FR: Poussez-vous devant !]  - Ah là, essayez de viser quelque chose de mou, une bande de neige, une botte de foin, quelque chose...  - Je vois une grosse bonne femme  avec deux gros hot dogs dans les mains, C'est correct ? Ça a l'air pas mal mou ça.  - Non non non, visez autre chose là monsieur ! Une poubelle... visez la poubelle !  - Ben oui, mais aller m'éclater sur une poubelle, ça va être commode à ramasser mes morceaux, ça ? Hé ! Oublie ça là ! Je vise la grosse, c'est ce que je vois de plus mou là. Va, t[u]'en enverras deux ambulances, ok ?  - Monsieur ? Allô ?  Allô ? Monsieur, êtes-vous là ? "
le-suffrage-universel-masculin-5-mars-1848,B2," Le suffrage universel masculin - 5 mars 1848 Saviez-vous que la France  a été le premier pays à instaurer le suffrage universel masculin ?  Bien que - techniquement - la Constitution de 1793 ait adopté le principe du suffrage universel,  ce dernier n'a jamais été appliqué à cette époque. Il faut attendre la Révolution de 1848  pour que ce mode de scrutin soit enfin mis en place. En effet, à la suite du soulèvement populaire qui a eu lieu à Paris en février 1848, Louis-Philippe abdique et la Seconde République est proclamée. Un gouvernement provisoire est instauré,  mettant fin à la Monarchie de Juillet.  Reste maintenant au nouveau régime à préparer l'élection d'une Assemblée constituante afin de donner au pays des institutions stables. Deux juristes, Cormenin et Isambert, sont chargés de rédiger un texte qui définisse de nouvelles règles électorales. C'est ainsi que le 5 mars 1848,  un décret instaure dans son article 5, le suffrage universel direct, qui marque une rupture avec le principe du suffrage censitaire  en usage sous les régimes précédents. Celui-ci réservait le droit de vote aux citoyens réputés assez riches pour être capables de voter avec discernement et en toute indépendance.  Le suffrage universel, lui, ouvre le vote  à tout homme âgé de plus de 21 ans  et résidant sur le territoire français depuis plus d'un an. C'est pourquoi le gouvernement provisoire n'hésite pas à proclamer, le 16 mars 1848 : ""À dater de cette loi, il n'y a plus de prolétaires en France.  Tout Français en âge viril est un citoyen politique.  Tout citoyen est électeur.  Tout électeur est souverain.  Le droit est égal pour tous.""  Le vote, qui doit maintenant être organisé pour 9 millions d'électeurs contre 240 000 sous la Monarchie de Juillet, est retardé du 9 au 23 avril 1848. Et une fois les résultats des élections connus,  la déception fait parfois place à la rebellion.  Par exemple à Rouen où les candidats conservateurs sortent vainqueurs,  les insurgés mettent en place une quarantaine de barricades.  On dénombre 39 morts, 53 blessés et 521 arrestations.  La nouvelle assemblée se réunit finalement le 4 mai  et proclame la République,  affirmant en substance que le pouvoir est dans les urnes et non dans la rue.  Lors des élections présidentielles de décembre 1848,  qui suivent de près le vote de la Constitution,  Louis-Napoléon Bonaparte est élu président de la République,  en promettant la paix et des réformes sociales.  Mais les règles électorales ne tardent pas à changer de nouveau. Le 31 mai 1850, l'Assemblée vote une loi  qui restreint le suffrage universel,  en imposant notamment d'avoir résidé au moins trois ans dans un canton  pour pouvoir y voter.  Le nombre d'électeurs redescend à 7 millions,  dans un pays de 35 millions d'habitants.  Mais il ne faudra attendre qu'un an pour voir le suffrage universel rétabli, à la suite du coup d'État de Louis-Napoléon Bonaparte du 2 décembre 1851. À partir de cette date, le suffrage universel ne sera plus remis en cause en France.  ""Et les femmes dans tout ça ?"" me direz-vous.  Après la Révolution de 1848, des femmes revendiquent  le droit de participer au vote, ce qui élargirait le droit de vote à 17 millions de citoyens. Jeanne Deroin écrit le 27 mars 1848 dans “La voix des femmes”  qui vient de voir le jour :  “On a proclamé la liberté, l'égalité et la fraternité pour tous.  Pourquoi ne laisserait-on aux femmes que des devoirs à remplir   sans leur donner les droits de citoyennes ? [...] Citoyens, les mères de vos fils ne peuvent être des esclaves.”  Ce sera en vain, et les femmes françaises devront attendre près d'un siècle pour que le droit de vote leur soit enfin accordé le 21 avril 1944. "
les-betises-de-cambrai-et-les-chardons-lorrains-specialites-de-france,B2," Bêtises de Cambrai, chardons lorrains, ces bonbons de nos régions  Ces bonbons que l'on appelle des ""bêtises"" ont rendu célèbre leur ville natale. Ville moyenne des Hauts-de-France, Cambrai est connue dans le monde entier.  - Alors on sait qu'il y avait déjà une tradition de fabrication de bonbons déjà à Cambrai depuis le Moyen-Âge. Aujourd'hui, [il] y a deux fabricants : la Maison Despinoy et la Maison Afchain. C'est deux anciennes maisons qui existent depuis la moitié du XIXe siècle, qui ont contribué au succès de la bêtise. Et aujourd'hui, on en mange  au Japon, en Australie, aux États-Unis, partout dans le monde.  La Maison Despinoy fabrique des bêtises selon la tradition qui remonterait à 1830. Le sucre y cuit encore dans des chaudrons de cuivre. - Ici, vous êtes dans l'atelier de fabrication, absolument oui. C'est ici qu'on fabrique toutes nos bêtises. Vous avez le sucre qui est coulé sur la table lorsqu'il est arrivé à température [de] 240 degrés. La pâte se travaille ensuite sur cette machine. - Et sur le pétrin, le sucre va être travaillé, aéré, donc oxygéné. Et grâce à l'oxygène de l'air, les sucres vont blanchir naturellement. C'est à partir du moment où le sucre est bien blanc, c'est à ce moment-là qu'on rajoute le parfum. Là, ce seront donc des huiles essentielles naturelles de menthe. - Et le parfum original ? - L'origine, c'est la menthe. Touche finale, le caramel qui donne sa bande jaune à la célèbre confiserie.  À l'origine de ces douceurs, de nombreuses légendes dont celle de la Maison Afchain, savamment entretenue par les héritiers. - Dans les années 1830, les parents d'Émile Afchain sont confiseurs à Cambrai. Émile Afchain est apprenti-confiseur chez ses parents et il fait une erreur, il fait une ""bêtise"", il laisse tomber de la menthe dans la masse de sucre. Il ne dit rien, il fait les bonbons, et les bonbons se vendent bien. Un bonbon rafraîchissant, [il] y a de la menthe dedans, donc effectivement il est très agréable au goût. Ses parents lui disent : ""Il faudrait que tu refasses les bonbons d'hier."". Et les bêtises étaient nées.  - Ce camion pouvait être utilisé pour livrer les bêtises dans les années 1920-1930. Le camion sert encore, il nous sert aux démonstrations. La bêtise de Cambrai se décline aujourd'hui en plusieurs parfums : pomme, violette, framboise ou encore coquelicot.  À Metz, on a troqué le sirop de menthe pour une gourmandise plus piquante. - Voilà ! Alors, on voit le sucre, on voit l'alcool.  Le chardon lorrain est l'un des plus difficiles à produire. Pour obtenir la liqueur,  il faut cuire de l'eau, du sucre, avec de l'eau-de-vie. Ensuite vient l'étape des coffrets. - Ben en fait, ça, c'est des coffrets d'amidon de maïs pour couler ensuite la liqueur. Artisan-confiseur, il a sept minutes pour opérer 1.200 coulages. - Vous pouvez en faire combien là, dans une journée ? - 3.500. [Il] faut que ça aille très vite. Du moment qu'on met l'alcool, il refroidit forcément, et c'est en refroidissant qu'il épaissit. Le but ? Créer des [sic:de] petites billes d'alcool que l'on enferme ensuite dans de l'amidon. Ainsi la liqueur reste tiède et ne durcit pas.  Les différentes couleurs indiquent l'alcool qui se cache à l'intérieur. - Donc le jaune, vous avez mirabelle, le vert, ce sera poire, le orange, c'est cognac, le rose, c'est framboise, le violet, c'est prune et le blanc, c'est kirsch. Le parfum préféré, ce sera la mirabelle. - Pourquoi ? - Parce que c'est un produit local, et qu'on trouve seulement en Lorraine.  - Donc voilà, 48 heures après le coulage, voilà ce que ça donne, une liqueur complètement durcie, liquide à l'intérieur. - Cent pour cent ? - Cent pour cent.  Des liqueurs trempées ensuite dans différents bains de cacao. - C'est la tradition, c'est notre histoire, c'est l'histoire de la Lorraine. Pour fabriquer un vrai chardon artisanal, comme on le travaille nous, en treize étapes sur trois jours de travail. Donc on les reprend treize fois en main du début à la fin. C'est très, très long. En fait, ça va beaucoup plus vite à manger qu'à fabriquer. On n'a pas du tout de trace de qui a créé le chardon au départ. Sur le secteur de Nancy, le chardon, c'est l'emblème de la ville, c'est l'emblème du club de l'AS Nancy-Lorraine. Puis je pense que c'est très important d'être chauvin, c'est très important de défendre son terroir, son histoire, ses spécialités. Aujourd'hui, on fabrique 2,5 tonnes de chardons.  Fabrice est l'un des plus grands chocolatiers français. Il livre sa production un peu partout, en Lorraine comme à l'étranger. - Alors Joseph, ça va bien ? Ben voilà, comme d'habitude, ça a mis [sic: on a mis] un petit assortiment avec une grosse partie de chardons mirabelle. Au pays de la mirabelle, le chardon est roi. Opération : dégustation. - [...] donc je vais le goûter ! - Qu'est-ce qu'on ressent ? - On a le côté croquant, et là on sent - comment dire ? - l'alcool de mirabelle qui est là, qui enrobe le tout. C'est très bon !  L'objectif des ces passionnés lorrains : perpétuer le savoir-faire et lutter contre le chardon industriel. "
les-francais-vus-par-les-etrangers,B2," Les Français vus par les étrangers dans le monde L'image que j'ai des Français, est celle d'un peuple arrogant même si je n'y suis jamais allé. C'est l'image que j'en ai à cause de la télévision et de ce qu'on en dit.  Les Français sont très organisés, respectés. Ils sont conscients de leurs droits et ils savent quoi revendiquer. J'aime vraiment ça, cette relation entre le gouvernement et ses citoyens.  Ils fument beaucoup trop et ils peuvent être, euh, comment dire ? ils peuvent être arrogants un peu. En revanche, ils ont un goût vestimentaire original.  J'ai été élevé à la, aux principes français, aux ""fraternité, égalité"", à la révolution. C'est ça pour moi l'identité française.  Les gens sont adorables. Ils ont un grand sens de l'humour et ils ont l'air très détendu.  C'est intéressant de voir que la France se penche sur des questions raciales, alors qu'aux États-Unis, cela fait des générations qu'on a réglé cette question. On n'associe pas l'identité ethnique à l'identité nationale. Tout le monde est américain : tant que vous êtes né aux États-Unis, vous êtes américain et ceci n'est pas remis en cause. "
les-animaux-en-vacances,B2," Les animaux en vacances PRÉSENTATEUR: À l'heure des départs en vacances, c'est chaque année le même ref-ain - le même refrain pardon -  près de dix mille [z]animaux ... animaux sont abandonnés par leurs propriétaires. Les refuges de la SPA [Société Protectrice des Animaux] se retrouvent submergés. Nous allons en parler dans un instant avec vous Natacha Harry. Je rappelle que vous êtes présidente de la Société Protectrice des Animaux, Mais d'abord je vous propose de découvrir comment se débrouillent celles et ceux  qui choisissent d'emmener leur animal de compagnie en vacances. C'est un reportage de Margaux Manière et Zidène Berkous à St-Pierre-la-Mer, dans l'Aude.  JOURNALISTE: Difficile de ne pas apercevoir un chien sur le marché de St-Pierre-la-Mer. Car pour beaucoup de vacanciers, pas question de faire garder son animal.  FEMME 1: C'est un yorkshire hein, donc (rires) on a toujours un peu peur de le mettre dans un refuge donc non, non, il est en vacances, il vient toujours avec nous.  HOMME 1: On [ne] sait jamais ce qui peut arriver avec d'autres chiens, les morsures et compagnie ... Je [ne] préfèrerais pas, non.  JOURNALISTE: Pour que tout le monde passe de bonnes vacances, il faut s'équiper.  FEMME 2: J'ai une petite bouteille d'eau, j'ai des croquettes. Normalement j'avais prévu un sac à dos, rien que pour lui, comme un béb... comme un enfant hein ! Comme un enfant, on s'en occupe comme un enfant.  JOURNALISTE: Pour la famille Ferrer, la cohabitation n'est pas toujours facile. Trois enfants, un chien, un chat.  FEMME 3: Là c'est la place du chat.  MARI 1: Ouais, il se cache tout le temps là-bas, lui. Pacha a son coin préféré.  MARI 1: Ah ça y est.  FEMME 3: [ç]a y est, je l'ai ! Ah c'est très galère ! C'est vrai que ... j'avoue que ... voilà, c'est ... bon, les sortir, c'est [sic: ce sont] les poils qui tombent, c'est voilà, c'est [sic: ce sont] deux places en plus qu'ils prennent ... Quand il [ne] se tapent pas !  JOURNALISTE: Mais les solutions de garde étaient trop chères, alors il a fallu s'adapter.  MARI 1: On n'est pas les bienvenus partout, surtout dans certains campings, on vous refuse les animaux. Là-dessus, [il] faut bien se renseigner, [il] faut bien préparer son itinéraire et voir où on est accepté.  JOURNALISTE: Eux aussi s'organisent pour que leur chien Icare  passe de bonnes vacances.  MARI 2: On va essayer de lui donner son ""nonoss"" [os], pour qu'il reste tranquille, voilà.  FEMME 4: Et sinon, il va à la plage, il nage ...  JOURNALISTE: Selon un sondage, quatre Français sur dix déterminent même leur séjour de vacances en fonction des goûts de leur chien. "
les-sites-touristiques-incontournables-de-la-guadeloupe,B2," Les sites touristiques incontournables de la Guadeloupe  Vous voilà arrivés à Pointe-à-Pitre, sous-préfecture de la Guadeloupe. Ne ratez pas le Mémorial ACTe,  inauguré en mai 2015, et dédié à l'histoire de l'esclavage.   Prenons à présent la route et rendons-nous à l'est de la Grande Terre. La Pointe des Châteaux proprement dite, et l'étroite presqu'île qui s'avance dans l'océan Atlantique à l'extrêmité sud-est de la Grande Terre. Le panorama est superbe depuis la falaise du Morne Pavillon, avec Marie-Galante au loin, les sommets de l'île de la Dominique, la Désirade, les îles de la Petite Terre. Rattachées à la Désirade, ces deux îles inhabitées sont classées Réserves Naturelles, sous la surveillance de l'ONF [Office National des Forêts]. Des excursions y sont organisées  et le spectacle du récif coralien est inoubliable.  On se rend ensuite à Morne-à-l'Eau. Principale curiosité de cette localité, son cimetière avec ses tombes en damier qui s'étendent sur une hauteur à l'entrée de la ville.  Direction la Basse Terre à présent. Découvrez la forêt tropicale  en empruntant la Route de la Traversée, puis le parc zoologique et botanique des Mamelles. Il constitue une visite aussi passionnante qu'instructive, durant laquelle vous apprendrez tout sur la faune et la flore de l'île.  Deshaies est un des plus charmants villages de la Guadeloupe. Ne ratez pas le jardin botanique ainsi que la plage de Grande Anse, sans doute la plus belle de l'île. Une vraie carte postale avec sable blanc et cocotiers.  De Malendure, en kayak ou à bord d'une embarcation, on se rend sur les îlets Pigeon pour explorer ses superbes fonds marins. Cette partie du littoral possède de nombreux spots, et la plus grande concentration de clubs de plongée de la Guadeloupe.  Attaquez-vous ensuite à l'ascension de la Soufrière, pour une randonnée d'environ 12km, et aux Chutes du Carbet, trois chutes faisant partie de la rivière du même nom et restées intactes dans le prestigieux décor du massif forestier  du versant sud-est de la Soufrière.  Enfin, au sud-est de la Basse Terre, le petit archipel des Saintes concentre le meilleur de la Guadeloupe. Belles plages, somptueux paysages, fonds marins exceptionnels. Les deux îles habitées, Terre-de-Haut et Terre-de-Bas, forment chacune un univers à part. "
lettre-au-pere-noel,B2," Lettre au Père Noël  Cher Père Noël, Avant tout, je voulais confirmer ce que tu sais sûrement déjà : cette année, j’ai été très sage. Je ne dis pas que j’ai été parfaite : parfois, je me suis disputée avec mes frères et sœurs, surtout avec Bastien qui me prend toujours mes jouets ! Mais ce n’était pas tout le temps, et j’ai aussi aidé ma petite sœur avec ses devoirs, j’ai fini mon assiette à tous les repas, j’ai eu de bonnes notes à l’école, j’ai rangé ma chambre et j’ai fait mon lit quand ma maman me le demandait.  J’espère que j’ai mérité mes cadeaux, et donc, cher Père Noël, voici la liste des choses qui me feraient plaisir : au magasin, j’ai vu un beau vélo bleu qui avait une petite lampe à l’avant. J’aimerais aussi un jeu de société auquel j’ai joué chez mon cousin, et qui était très rigolo. Et depuis quelque temps, j’ai pris l’habitude de dessiner des BDs de super héros, donc une boîte de crayons de couleur serait très utile !  Voilà ! Je vous souhaite bien du courage à toi et à tes elfes pour préparer tous nos cadeaux !  À bientôt ! Lise "
lettre-de-nicolas-bedos-a-son-pere-le-comedien-guy-bedos,B2," Lettre de Nicolas Bedos à son père, le comédien Guy Bedos Lecture par Augustin Trapenard  Paris, le 31 mai 2020  Papa Une dernière nuit près de toi. Des bougies, un peu de whisky, ta main si fine et féminine qui serre la mienne jusqu'au petit jour du dernier jour. Ton regard enfantin qui désarme un peu plus le gamin que je redeviens. Au-dessus de ton lit, un bordel de photos, de Jean-Loup Dabadie à Gisèle Halimi,  de Desproges à Camus en passant par Guitry. Ça ne votait pas pareil, ça ne priait pas les mêmes fantômes, mais vous marchiez groupés dans le sens de l'humour et de l'amour. Au bout de tes jambes qui ne marchent plus, tes chats, sereins comme des gardiens. Sur la table de nuit, un fond de verre de Coca, ultime lien entre ce monde et toi, quelques gorgées de force qui te permettent, du fin fond de ta faiblesse, de nous lancer des gestes d'une élégance et d'une tendresse insolentes. Fâché de ne plus pouvoir parler, tu envoies des baisers muets à ta femme adorée, à ta fille bien aimée, à la fenêtre de l'île Saint-Louis, au soleil que tu fuis. Des gestes silencieux qui font un boucan merveilleux dans nos yeux malheureux. Tu auras mélangé les vacheries et l'amour jusqu'au baisser de rideau. Les ""foutez le camp"" et les ""je t'aime"". Caresses et gifles, jusqu'au bout. Incorrigible cabotin, tu avais bien prévu ton coup :  dans ton dernier morceau de mémoire, tu avais mis des ""vous êtes beaux, je suis heureux, j'ai de la chance. C'est ta mère, là, devant moi ? C'est ma femme ? Oh tant mieux !""  On va t'emmener maintenant, dans ton costume de scène. Celui des sketches et des revues de presse, des télés et des radios, celui qui arpenta la France, en long en large et en travers de la gorge de certains maires.  J'ai dénoué ta cravate noire. On va t'emmener où tu voulais, c'est toi qui dictes le programme, c'est toi qui conduis sans permis.  D'abord à l'église Saint-Germain, tu n'étais pas très pote avec les religions, mais les églises, ça t'emballait. Tu disais :  ""[Il] Faudrait qu'on puisse les louer  pour des spectacles de music-hall, des projections de films, des concerts de poésie"". Il y aura des Athées, plein d'Arabes et plein de Juifs. Ça aurait consterné ta mère, tu aurais bien aimé que ta mère soit fâchée.  Puis on t'envole en Corse, dans ce village  qui te rendait un peu ta Méditerranée d'Alger. On va chanter avec Izia et les Tao, du Higelin, du Trénet, du Dabadie et Nougaro. On va te faire des violons, du mélodrame a cappella. [Il ne] Faut pas mégoter son chagrin à la sortie d'un comédien. [Il] Faut se lâcher sur les bravos et occuper chaque strapontin. C'est leur magot, c'est ton butin. D'autant que je sens que tu n'es pas loin... Tu n'es pas mort, tu dors enfin.  Nicolas Bedos "
lynda-lemay-les-maudits-francais,B2," Lynda Lemay - Les Maudits Français  À l'occasion de la Saint Jean Baptiste (le 24 juin), Fête Nationale du Québec, et de la Fête de la Musique (le 21 juin), voici une chanson de la chanteuse-compositrice québécoise Lynda Lemay qui se moque de la façon dont  les Québécois voient les Français.  Y [Ils] parlent avec des mots précis  Pis y [Puis ils] prononcent toutes leurs syllabes À tout bout de champ, ils se donnent des bis [bises] Y [Ils] passent leurs grand[e]s journées à table  Y ont [ils ont] des menus qu'on [ne] comprend pas Y [Ils] boivent du vin comme si c'était de l'eau Y [Ils] mangent du pain pis [puis] du foie gras En trouvant le moyen de [ne] pas être gros  Y [Ils] font des manifs au quart d'heure À tous les maudits coins de rue Tous les taxis ont des chauffeurs Qui roulent en fous [FR: comme des fous], qui collent au cul  Et quand y [ils] parlent de venir chez nous C'est pour l'hiver ou les Indiens Les longues promenades en Ski-doo Ou encore en traîneau à chiens  Ils ont des tasses minuscules Et des immenses cendriers [sic d'immenses cendriers] Y [ils] font du vrai café d'adulte Ils avalent ça en deux gorgées  On trouve leurs gros bergers allemands Et leurs petits caniches chéris Sur les planchers des restaurants Des épiceries, des pharmacies  Y [Ils] disent qu'y [qu'ils] dînent quand y [ils] soupent Et y [il] est deux heures quand y [ils] déjeunent Au petit matin, ça sent le yaourt Y [Ils ne] connaissent pas les œufs-bacon  En fin de soirée, c'est plus ""choucroute"" Magret de canard ou escargots Tout se déroule bien jusqu'à ce qu'on goûte À leur putain de tête de veau  Un bout de paupière, un bout de gencive Un bout d'oreille, un bout de museau Pour des papilles gustatives de Québécois C'est un peu trop  Puis, y [ils] nous prennent pour un Martien Quand on commande un verre de lait Ou quand on demande : La salle de bain est à quelle place, s'il vous plaît ? [In France, you'd say ""Où sont les toilettes""]  Et quand ils arrivent chez nous Y [Ils] se prennent une tuque et un Kanuk Se mettent à chercher des igloos Finissent dans une cabane à sucre Y [Ils] tombent en amour sur le coup Avec nos forêts et nos lacs Et y se mettent à parler comme nous Apprennent à dire : Tabarnak  Et bien saoulés au Caribou À la Molson et au gros gin Y [Ils] s'extasient sur nos ragoûts de pattes de cochon  Et nos plats de binnes  Vu qu'on n'a pas de fromages qui puent Y [Ils] s'accommodent d'un vieux cheddar Et y [ils ne] se plaignent pas trop non plus De notre petit café bâtard  Quand leur séjour tire à sa fin Ils ont compris qu'ils [n']ont plus le droit De nous appeler les Canadiens Alors que l'on est québécois Y [Ils] disent au revoir, les yeux tout trempés Le sirop d'érable plein les bagages On réalise qu'on leur ressemble On leur souhaite bon voyage  On est rendu qu'on donne des becs Comme si on l'avait toujours fait [Il] y a comme un trou dans le Québec Quand partent les maudits Français "
