name,cefr,textquand-je-serai-grand,B1," Quand je serai grand  Quand je serai grand,  je serai danseur  j'inventerai des pas  que tu ne verras nulle part ailleurs  Quand je serai grand,  je n'aurai pas peur  je regarderai plein de films d'horreur  Quand je serai grand,    je serai cuisinière  et je ferai des ratatouilles d'enfer  Quand je serai grand, je serai modeste  j'éviterai ainsi de parler aux pestes  Quand je serai grand,  je resterai un enfant   Quand je serai grand, je serai très beau  j'aurai plein d'abdos  Quand je serai grand,  j'aurai un bateau  et je naviguerai jusqu'à Rio  Quand je serai grand, je serai sérieuse  et j'aurai une vie merveilleuse  Quand je serai grand, je serai râleuse  mais quand même heureuse  Quand je serai grand,  je resterai un enfant   Quand je serai grand, je serai milliardaire  et je dormirai sur des billets verts  Quand je serai grand, je serai populaire  et je ne pourrai plus prendre l'air  Quand je serai grand,   j'aurai un chihuahua  et je l'appellerai miss Erika  Quand je serai grand, je serai un roi  c'est moi qui ferai la loi  Quand je serai grand, je serai vieux  et je laisserai pousser mes cheveux   Quand je serai grand,  je resterai un enfant   Quand je serai grand, je serai maçon  et je construirai plein de maisons  Quand je serai grand,   j'aurai de l'argent  et j'en donnerai aux pauvres gens  Quand je serai grand, je serai le temps  et j'éviterai de faire du vent  Quand je serai grand, je serai brillant  et je n'aurai pas besoin de clignotant  Quand je serai grand, je serai mécanicien  et je réparerai les véhicules anciens  Quand je serai grand, je serai un arbre  et je serai solide comme du marbre  Quand je serai grand, je serai belle  et je volerai de mes propres ailes  Quand je serai grand, je serai présidente  et je serai vaillante  Quand je serai grand,  je resterai un enfant   Quand je serai grand, je serai gentille  et je jouerai aux billes  Quand je serai grand, je serai un zombie  on me fera rentrer dans ""Call of Duty""  Quand je serai grand, je serai stylée  je ferai craquer tous les quartiers  Quand je serai grand, je serai rappeur  et j'aurai cette mélodie dans le cœur   Quand je serai grand,  je resterai un enfant  "
quelques-faits-interessants-sur-le-francais,B1," Quelques faits intéressants sur le français  Elle s'appelle la langue de l'amour et la langue de Molière ... que savez-vous de la langue française ?  Près de 230 millions de personnes parlent le français, qui est une langue officielle dans 29 pays et des dizaines d'organisations internationales. Selon la banque d'investissement Natixis, environ 750 millions de personnes parleront le français en 2050.  Une langue protégée  Diverses organisations protègent et promeuvent le français. Voici les plus connues d'entre elles :  L'Alliance française propose des cours et des activités culturelles dans 136 pays à travers le monde.  L'Académie française est chargée de protéger le français de l'incursion des mots étrangers avec - il faut le dire - un succès très limité.  Depuis 1996, le Conseil supérieur de l'audiovisuel (CSA) requiert que 40 % de la musique jouée à la radio soit française, dont la moitié au moins  doit avoir moins de six mois. De surcroît, depuis 1970, 50 % des films à la télé doivent être français.  Faits historiques  Au déclenchement de la Révolution (1789), trois quarts des Français ne parlaient pas le français comme langue maternelle.  Le français se parlait presque exclusivement en Angleterre de 1066 jusqu'à la fin du XIIIe siècle. (Le latin était la langue écrite officielle.)  Le mot « France » vient du mot latin « Francia », qui veut dire « le pays des Francs ». Avant que les Romains ne soient expulsés, la région s'appelait « la Gaule ». "
recette-le-gratin-boeuf-potiron-et-parmesan,B1," Recette - Le Gratin Boeuf, Potiron et Parmesan  Bonjour ! Soyez les bienvenus dans ""Recette Roulette"". La recette du jour est... le gratin boeuf, potiron et parmesan.  Pour 6 personnes, il nous faut : - 2 kilos de potiron ou 1 kilo de potiron et 1 kilo de pommes de terre - 500 grammes de bœuf haché - 150 grammes de lard fumé - 2 oignons - 3 gousses d'ail - 100 grammes de beurre - 80 grammes de parmesan râpé - 1 bouquet de persil - 1 pincée de noix de muscade - du sel et du poivre  Pour commencer ce gratin, on va faire une purée avec le potiron; donc soit le potiron tout seul comme moi, soit potiron et pommes de terre si tu as choisi cette option. Pour cela, on découpe les légumes en dés et on les met à cuire avec un fond d'eau à couvert, dans une casserole,  jusqu'à ce qu'ils soient bien tendres, c'est-à-dire entre 15 et 20 minutes pour le potiron, et les pommes de terre parfois, c'est un petit peu plus long.  Le potiron est cuit, je vais le réduire...en purée ! Si comme moi [sic: la mienne], ta purée est un peu aqueuse, il suffit de la dessécher un peu sur feu doux, pendant qu'on prépare le reste des ingrédients. N'oublie pas de remuer !  Mets le four à préchauffer à 210° (Celsius), et pendant que ça chauffe, nous, on va s'occuper du reste des ingrédients. On va hacher l'oignon et l'ail, puis mettre tout ça à rissoler dans une poêle avec la viande, tout ça, tu vas voir, ça va être super !  Je fais fondre la moitié du beurre, et ensuite je fais suer tranquillement l'ail et l'oignon pendant environ trois minutes. C'est au tour des lardons d'entrer en piste ! J'ajoute la viande, du sel, du poivre, et le persil haché. Pour cela, il me faut le persil et les ciseaux.  Il ne nous reste plus qu'à sortir le plat à gratin et à tout mettre dedans.  Je saupoudre de parmesan. Je mets le reste du beurre en morceaux sur le gratin. Et après, il ne me reste plus qu'à enfourner pour 20 minutes de cuisson.   Le gratin de potiron au bœuf et au parmesan est prêt !  Si tu veux rester dans un esprit ""courge"", je t'invite à réaliser le gratin de courgettes à la viande. Un petit délice de derrière les fagots !  Bon, c'est pas tout ça,  mais moi j'aimerais savoir  quelle est ta courge préférée. Dis-le-moi dans les commentaires, et ""nota bene"" (N.B.), la réponse n'est pas claire.  Je te donne rendez-vous demain à 11h pour une nouvelle recette. Et pour ne pas en rater une miette, abonne-toi à la chaîne Marmiton ! C'est très simple, il te suffit de m'appuyer dessus ! Ouch ! Pas trop fort ! Aïe ! "
rentree-scolaire-limiter-les-depenses,B1," Rentrée scolaire : les tuyaux pour limiter les dépenses Des courses de rentrée réussies commencent à la maison. Un rapide coup d'œil dans ses placards permet d'éviter les achats inutiles.  On regarde ce qui peut être réutilisable, ce qui peut éventuellement servir au petit frère ou à la petite sœur. Quand le tri est fait, on prépare la liste avec les enfants, mais à la maison. On regarde ce dont on aura besoin réellement.  Et si vous décidez d'emmener vos enfants avec vous  pour faire les courses, une astuce pour tenir votre budget : laissez-leur [sic: laissez-les] choisir un objet ""coup de cœur"", et restez ferme sur le reste.  C'est sur ces objets-là qu'on peut effectivement faire plaisir à un enfant. La trousse, c'est quand même quelque chose qu'on ouvre tous les jours... Puis, ça n'entraîne pas des frais très très importants.   Pour éviter les frais justement, vous pourriez être tentés de prendre uniquement des premiers prix, mais ils ne riment pas toujours avec ""économies"".  Un cartable qui [ne] va pas coûter très cher va être quand même d'une qualité relativement médiocre, va s'abîmer et résultat, ben dans un trimestre, il faut recommencer.  Attention aussi aux lots : des paquets de feuilles peuvent être réutilisées d'une année sur l'autre, pas des tubes de colle. Cette année, une famille devrait dépenser en moyenne  près de 98 euros pour un enfant en primaire, plus de 130 pour un collégien. "
rentree-scolaire-la-dictature-de-la-mode,B1," Rentrée scolaire : la dictature de la mode  En plus des fournitures, les vêtements font partie des achats incontournables de la rentrée. Et à chaque décennie sa tendance. Florilège.  Pour les écoliers de France,  la rentrée a ramené cependant des plaisirs qu'on n'éprouve qu'à cet âge. Dans les années 50-60, le tablier, appelé aussi la blouse, était de rigueur. En plus de son côté pratique, il permettait de gommer toute différence sociale entre les élèves. Et il y avait l'embarras du choix. Quel tablier choisir maintenant ? Celui qui fait fureur est noir, vous le savez, comme celui de nos pères, mais égayé et d'un pli soufflé, d'un col corolle rose buvard... Encore des carreaux rose et blanc, mais beaucoup de quadrillés blancs ou rouges sur fond noir [...]  Dans les années 70,  le tablier est dépassé. Dans l'air des Seventies, place à la couleur,  et au blouson en cuir !  Toujours aussi colorées, les années 80 soufflaient un vent de liberté dans la cour de récré. Et à la rentrée, chacun imposait son style. - Ben moi, je suis plutôt Fifties, les années 50.  - [Il] y a plein de New Wave partout !  - J'ai décidé donc d'être ""petite fille modèle"", donc je suis arrivée en petite fille modèle ! Mais demain, j'arriverai avec les cheveux verts... À cette époque, le jean était sans nul doute  le vêtement indispensable pour se faire remarquer. L'incontournable pour être cool. - Comme en jean, tu peux t'habiller comme tu veux, quoi. Par exemple, quand tu vas dans un bureau, t'as [tu as] la cravate et tout... intellectuel, quoi ! Et quand tu vas en boum, je [ne] sais pas, gros pull, avec le jean... disco, quoi !  Dans les années 90,  la mode hip hop s'imposait en France, et aussi dans les cours de récré. - T'as [Tu as] du succès avec ça ?  - Ouais, quand même ! Et pour être dans le coup, les baskets étaient de rigueur. Pour la frime ou pour le sport, chaque écolier avait sa paire pour la rentrée. Attention, les voilà ! Elles envahissent le territoire. Françaises et surtout américaines, elles sont omniprésentes dans les écoles, les stades ou les rues : ce sont les baskets. On estime à un million et demi le nombre de ces chaussures  qui seront vendues cette année à la rentrée, le double de l'an dernier.  Dans les années 2000, le tablier faisait son retour, principalement dans les écoles privées. Même si ce vêtement a beaucoup évolué, pas question de jouer la séduction. Un modèle pour les garçons, un autre pour les filles, le nom de l'enfant comme seule fioriture, et des poignets élastiques.  Tablier, blouson en cuir ou jean, finalement, quelque soit le style, l'important c'est surtout de faire la différence à la rentrée. "
roland-garros,B1," Roland-Garros   Le tournoi de Roland-Garros se déroule chaque année depuis 1925, sur deux semaines entre fin mai et début juin au stade Roland-Garros à Paris, en France. Ce stade tient son nom de l'aviateur français Roland Garros.  Roland-Garros, aussi connu sous le nom d'Internationaux de France, est l'un des quatre tournois du Grand Chelem de tennis, qui comprend également l'Open d'Australie à Melbourne, Wimbledon à Londres et l'US Open à New York. La spécificité de ce tournoi vient du fait qu'il est le seul des quatre à se jouer sur terre battue. Cette surface, qui a tendance à faire durer les échanges en ralentissant le jeu, fatigue particulièrement les joueurs. Ajoutez à cela le fait qu'il n'y ait pas de jeu décisif dans le cinquième set final - contrairement à l'US Open par exemple - et vous comprendrez que  Roland-Garros soit souvent considéré comme le tournoi le plus exigeant physiquement au monde.  La compétition a lieu sur vingt courts de terre battue, dont le principal est le court Philippe-Chatrier.  Les quatre premiers jours sont réservés aux qualifications,  puis commence la quinzaine de compétition.  La coupe des Mousquetaires est remise au vainqueur du simple messieurs,  et la coupe Suzanne-Lenglen à celle du simple dames.  Des trophées récompensent également les gagnants des double messieurs, double dames et double mixte. "
romance-au-marche,B1," Romance au marché Ce matin-là, j'avais la banane ! Mes bouts de chou étaient chez leurs grands-parents et je m'étais préparé une journée aux petits oignons. Pour commencer, direction le marché : j'adore me balader dans les allées de bons produits frais et m'enivrer de toutes ces bonnes odeurs !  À l'étal des fruits et légumes,  un monsieur élégant, un chapeau melon sur la tête, était en train de discuter avec le vendeur, un jeune homme aux cheveux poils de carotte :  - Mais voyons Monsieur, vous me prenez pour une poire ! Ce n'est pas possible !  - Si je vous jure,  je ne vous raconte pas de salades !  - De quoi parlez-vous ? demanda une dame haute comme trois pommes.  - Eh bien, reprit le monsieur, vous connaissez Mme Baguette, la boulangère... Ce matin, elle passait devant le stand de fromages de Monsieur Bernard, quand tout à coup elle est tombée dans les pommes ! Évidemment, Mr Bernard s'est précipité pour l'aider, et il la tenait dans ses bras quand elle est revenue à elle. Et là, ça a été le coup de foudre ! Ils sont restés là, plantés comme des poireaux au beau milieu de la rue, elle, rouge comme une tomate, lui, avec des yeux de merlan frit !  Et à ce moment-là, cerise sur le gâteau, les nuages se sont écartés et un arc-en-ciel est apparu dans le ciel ! On se serait cru dans un de ces navets à l'eau de rose !  Moi, cette histoire m'a vraiment donné la pêche, pas vous ? "
rosh-hashana,B1," Roch Hachana: une tradition juive Autre aspect de la tradition de Roch Hachana, ça se passe dans les maisons. On est avec M. Chamszadeh, on retrouve notre rabbin et Daniel Leclaire. Alors, parle-nous de cette tradition, à la maison, avec les gens qu'on aime. Comment ça se passe ?  Alors le soir, quand on rentre de la synagogue, on va faire le kiddush de la fête, comme d'habitude, puis on va commencer à manger des choses qui portent une symbolique particulière, et qui vont porter, en vérité, l'idée de l'année que l'on se souhaite.  D'ailleurs, c'est parfois même le symbole de la fête, c'est la pomme et le miel. La pomme parce que c'est sucré, et le miel parce que c'est doux. Et alors on trempe la pomme dans le miel, et quand on trempe la pomme dans le miel, on se souhaite d'avoir une année douce comme le miel.  [Il] y a la grenade également...  Alors la grenade, c'est encore un sens particulier, puisque quand on regarde une grenade, on se rend compte que quelque part, elle a un peu la forme d'un cœur et il y a plein de grains dedans. Et donc nous nous souhaitons d'avoir, je dirais, une... un cœur plein de bonnes actions comme la grenade, autant que la grenade a de grains.  Ça, c'est la tradition juive, alors vous, vous êtes juif iranien M. Chamszadeh.  Juif iranien.  Est-ce que la tradition est la même ?  Certains choses, c'est la même [sic: Certaines choses sont les mêmes] et d'autres choses, ça change. Nous avons plus, peut-être, d'autres choses à faire des berakhot là-dessus. [sic: nous avons d'autres choses à bénir en disant des berakhot.]  C'est quoi les berakhot ?  Les berakhot, c'est [sic: ce sont] les ... bénédictions.  Les bénédictions, et aussi les petits textes qu'on lit avant de manger.  Mais nous les faisons aussi en iranien.  La bénédiction, vous la faites en hébreu et en iranien. (Oui) Vous pouvez nous faire une petite bénédiction en iranien ?  ...  C'est une bénédiction en iranien.  C'est en iranien.   La culture ashkénaze ou séfarade, tu l'évoquais, c'est la même chose ce soir à Roch Hachana ?  Quasiment la même chose. [Il ne faut] pas oublier par exemple, c'est qu'on mange ou la tête du poisson, ou la tête d'agneau, là encore une autre symbolique. Parce qu'à Roch Hachana... bon d'abord c'est la tête de l'année, donc c'est ""Roch - Hachana"", ""Roch"" c'est la tête, ""Hachana"" l'année, et on se souhaite d'être à la tête, et non pas à la queue.  Donc on mange la tête du poisson.  Donc on mange la tête du poisson, ou la tête de l'agneau, pour se souhaiter d'être à la tête.  Qu'est-ce qui est important pour vous, Dan Leclaire, dans Roch Hachana ? C'est... Elle a quelle signification  cette fête juive ?  C'est avant tout une fête de famille, mais pas une fête au sens ""on fait des cotillons et des pétards"", c'est vraiment la fête de la retrouvaille, la fête de la retrouvaille des familles, également de ses proches, dans lequel [sic: laquelle] on prie  pour que notre année soit bonne,  pour soi, et pour les siens et pour sa famille. C'est donc un moment, outre de fête, de recueillement, mais également d'introspection et de partage.  Alors, je me tourne vers vous M. Chamszadeh, nous sommes en 5774, comment est-ce que je vais souhaiter en hébreu ""Bonne Année"" à quelqu'un ? Comment on le dit ?  ""Shana tova"", tout simplement !   ""Shana tova"", c'est suffisant ? (Oui) Eh bien, écoutez, Shana tova à tous ! Fêtez bien en famille ! Merci pour votre accueil ! On voulait vous montrer Roch Hachana,  cette belle fête juive. "
septembre-chez-mes-grands-parents,B1," Septembre chez mes grands-parents  Quand j'étais petite, le mois de septembre était synonyme de tradition familiale. En effet, tous les ans, pour fêter l'arrivée de l'automne, nous passions le dernier weekend de septembre chez mes grands-parents dans le Limousin.  Nous y retrouvions le reste de la famille : les cousins, tantes, neveux... au total, nous étions plus de 50 chaque automne ! Heureusement, la maison familiale pouvait loger tout le monde - c'était plus un manoir qu'une maison - même si nous les enfants préférions planter nos tentes dans l'immense jardin  et profiter des dernières chaleurs de l'été indien.   Chaque année, j'attendais ce weekend avec impatience, et je me réjouissais en particulier  de passer du temps avec ma grand-mère. Je me souviens de ses longs cheveux ondulés d'une blancheur éclatante. Ils reflétaient les rayons pâles du soleil automnal comme un doux duvet pailleté.  Dès que nous descendions de la voiture, je courais la rejoindre derrière la maison où elle m'attendait sous la véranda. Puis ensemble, nous buvions de la citronnade en parlant de tout et de rien... Je réalise à présent que c'était surtout moi qui parlais, tandis que ma grand-mère m'écoutait de son air bienveillant. Nous rejoignions ensuite les autres pour le reste de la journée, mais ce sont ces moments privilégiés qui resteront à jamais gravés dans ma mémoire. "
soiree-d-hallowe-en,B1," Soirée d'Halloween à Pfaffenhoffen en Alsace JOURNALISTE 1: Mille deux cents personnes venues trembler de peur, la soirée d'Halloween hier à Pfaffenhoffen a fait un carton. À l'origine, un jeune décorateur amateur  qui a transformé le garage automobile de la ville en maison hantée. Les visiteurs ont dû survivre à un parcours semé d'embûches et de monstres en tous genres pour obtenir des bonbons. Frissons et succès garantis !  Le reportage de Marie Coulon et Emmanuel Gambette :  JOURNALISTE 2: C'est le genre d'endroit  dans lequel vous n'avez pas vraiment envie d'entrer, parce qu'une fois à l'intérieur... vos nerfs sont mis à rude épreuve. Les mécaniciens du garage ont fini comme ça, pendus à des crochets. Devenus mort-vivants, ils veulent transformer les visiteurs  en barquettes de viande. Un peu ""gore"", d'accord, mais frissons garantis.  C'est comment ?  VISITEUSE: Très bien. Ça fait peur !  VISITEUSE 2: Oh, ça fait peur, hein, ça fait peur, mais même les grands, ils ont peur !  JOURNALISTE 2: Au total, 400 mètres carrés de parcours semé d'embûches. Le projet fou d'un jeune artiste de 28 ans originaire de Pfaffenhoffen.  ARTISTE: Non, c'est vraiment le moment où je peux me faire le plus plaisir en art, euh, c'est là où on se défoule  et on va au-delà de nos limites, et on profite comme aujourd'hui vraiment d'un espace pour faire encore plus grand, toujours plus grand que ce qu'on a déjà fait.  JOURNALISTE 2: Jean-Christophe Matz a déboursé mille euros sur ses fonds propres et mobilisé plusieurs entreprises locales  pour réaliser en seulement deux mois ce garage hanté. Avec l'aide aussi d'une bande de copains un peu mal en point ! Leur but : offrir un vrai spectacle aux petits comme aux grands.  FILLETTE: Les acteurs, ils mettaient bien en scène, ça faisait super peur.  VISITEUSE: Les décors sont supers, vraiment c'est bluffant ! Les squelettes, et puis les maquillages, euh, enfin c'est vraiment, vraiment magnifique ! À faire peur !  JOURNALISTE 2: Et pour avoir failli mourir de peur, une petite récompense tout de même !  FEMME: Vous venez d'où ? Vous êtes combien ?  JOURNALISTE 2: Au total, près de 1 200 courageux sont venus de toute l'Alsace pour participer à cette nuit de l'horreur.  JOURNALISTE 1: Et c'est la fin de ce flash d'information, merci de l'avoir suivi. L'info continue... "
songkran-thai-new-year,B1," Songkran - Le nouvel an thaïlandais Le Nouvel An bouddhiste est appelé « Songkran », qui vient du mot sanskrit signifiant « passer dans ». Songkran est célébré en Birmanie (d'où il est originaire), au Cambodge, au Laos et au Viêt Nam, mais les célébrations les plus insolites ont lieu en Thaïlande, ce qui explique pourquoi on l'appelle souvent le Nouvel An thaïlandais.  Traditionnellement fêté du 13 au 15 avril, Songkran est le plus long festival de Thaïlande, et célèbre la spiritualité et les bonnes actions. Les gens visitent des temples et font l'aumône aux moines, et l'eau joue un rôle clé en tant que symbole de purification et de 	
rejuvénilisation. Elle est versée sur les statues de Bouddha et sur les mains des aînés. Mais le rituel le plus célèbre est la bataille d'eau collective. Il y a également des défilés traditionnels, un concours de beauté « Miss Songkran », ainsi que d'autres traditions qui varient selon la région. "
tour-de-france-1,B1," Le Tour de France Surnommé Le Tour ou la Grande Boucle, le Tour de France est le « grand tour » le plus ancien et le plus prestigieux du cyclisme professionnel. Pendant trois semaines, les cyclistes font jusqu'à 250 kilomètres chaque jour, pour un total de 3 500 kilomètres environ.  Si le parcours change chaque année, en visitant des villes et villages variés et en entrant dans différents pays avoisinants, le format est fixe. Il passe toujours à travers les Alpes et les Pyrénées, il y a au moins un contre-la-montre et la ligne d'arrivée se trouve toujours sur les Champs-Élysées. Le tracé alterne chaque année entre le sens horaire et antihoraire de la France.  Le premier Tour de France n'était rien de plus qu'un coup de pub. Géo Lefèvre, journaliste, et Henri Desgrange, directeur et rédacteur en chef de l'Auto, en ont eu l'idée en 1903 pour augmenter les ventes du journal. Cinquante-neuf hommes sont partis pour faire 2.428 kilomètres éreintants dans l'espoir de gagner 20 000 francs (l'équivalent de 77 000 euros en tenant compte des anciens francs et de l'inflation). Sans équipes, routes goudronnées ni même de casques, ils ont pédalé jour et nuit. Seuls 21 coureurs sont arrivés à la fin, dont Maurice Garin, le professionnel de 32 ans qui a gagné d'une seule minute après 19 jours de course ! "
un-coeur-en-hiver-french-film-fest,B1," Le choix de Rowen : Un Cœur en hiver Ce film de 1992 vous fait penser à la musique, à l'art et à la psychologie humaine. Il est plein de sujets sous jacents, dont les nuances avec lesquelles les gens interprètent les expressions des autres.  La musique de Ravel est sublime, la cinématographie est incroyable et la scène avec tous les personnages principaux autour du dîner sur la terrasse pendant une soirée douce estivale est pimentée de méfiance peu voilée et d'un bon vieux débat vif sur l'art. "
